candidate_scope,candidate_id,candidate_label,source_id,source_family,evidence_level,candidate_type,decision_status,decision_class,decision_predicate,rationale,assumptions_or_heuristics,reviewer_or_role,source_artifact,linked_artifact,evidence_detail
search_route,phase2-baseline-comparison,Import completed comparative simulation ontology mapping inventory as Phase 2 baseline.,,baseline_artifact,mixed,baseline_artifact,included_for_phase2_register,included,,Preserves the completed comparison baseline before appending new article-hardening candidates.,Baseline inventory was already curated and is not a fresh live registry search.,"evidence_curation_researcher,reproducibility_curator",docs/article-hardening/search-log.jsonl,docs/ontology-comparison/source-inventory.json,"{""filters"":{""source"":""repo-local baseline"",""version"":""2026-06-24""},""included_count"":21,""result_count"":21,""screened_count"":21,""source_ids_added"":[""bfo"",""devs"",""dolce"",""emmo"",""game_ontology_project"",""gdlf_gamelan"",""hla_fom"",""kaos"",""kisao"",""miase"",""odd_protocol"",""ontouml_ufo"",""osmo"",""owl_time"",""p_plan"",""prov_o"",""schema_org"",""sed_ml"",""ssn_sosa"",""vimmp_ontologies"",""xmile""]}"
search_route,phase2-mapping-standards,SSSOM ROBOT OAEI ontology mapping standard review publication,,web_search,metadata_only,web_search,included_for_phase2_register,included,,"Adds mapping publication, review, and quality-method sources needed to harden UOGTO mapping evidence.","Method/tool records support reporting and validation design, not ontology overlap counts.","standards_landscape_researcher,methods_editor,ontology_peer_reviewer",docs/article-hardening/search-log.jsonl,"SSSOM, ROBOT, and OAEI mapping-method surfaces","{""filters"":{""artifact_type"":""ontology/schema/formalism/standard"",""date_range"":""not_limited"",""language"":""English""},""included_count"":3,""result_count"":3,""screened_count"":3,""source_ids_added"":[""oaei"",""robot"",""sssom""]}"
search_route,phase2-game-description,GDL GDL-II GDL-III GDLZ Ludii VGDL General Video Game AI game description language,,project_site,structured_non_rdf,project_site,included_for_phase2_register,included,,"Adds game-description and game-AI formalism sources likely to expose rule, move, state, imperfect-information, and execution gaps.",Some sources are literature-only or repository-version dependent; exact artifact acquisition is deferred to Phase 3.,"game_theory_gap_researcher,evidence_curation_researcher",docs/article-hardening/search-log.jsonl,Game description language and game AI project sites,"{""filters"":{""artifact_type"":""ontology/schema/formalism/standard"",""date_range"":""not_limited"",""language"":""English""},""included_count"":4,""result_count"":4,""screened_count"":4,""source_ids_added"":[""gdl_ii_iii_gdlz"",""gvgai_vgdl"",""ludii"",""stanford_gdl""]}"
search_route,phase2-simulation-standards,PNML BPMN OWL-S PDDL Petri net process planning ontology simulation standard,,standards_body,structured_non_rdf,standards_body,included_for_phase2_register,included,,"Adds process, Petri-net, service/action, and planning standards adjacent to UOGTO simulation and execution semantics.",Several standards have metadata-only or restricted redistribution status until licence review.,"standards_landscape_researcher,reproducibility_curator",docs/article-hardening/search-log.jsonl,"Simulation, process, planning, and workflow standards","{""filters"":{""artifact_type"":""ontology/schema/formalism/standard"",""date_range"":""not_limited"",""language"":""English""},""included_count"":4,""result_count"":4,""screened_count"":4,""source_ids_added"":[""bpmn_2"",""owl_s"",""pddl"",""pnml""]}"
search_route,phase2-systems-biology,SBML SBO CellML SBGN SED-ML KiSAO MIASE simulation ontology standard,,standards_body,structured_non_rdf,standards_body,included_for_phase2_register,included,,"Adds systems-biology modelling standards relevant to simulation experiments, algorithms, model dynamics, and reporting.","Domain-specific sources must be framed as modelling/simulation comparators, not game-theory ontologies.","standards_landscape_researcher,methods_editor",docs/article-hardening/search-log.jsonl,COMBINE and systems-biology modelling standards,"{""filters"":{""artifact_type"":""ontology/schema/formalism/standard"",""date_range"":""not_limited"",""language"":""English""},""included_count"":4,""result_count"":4,""screened_count"":4,""source_ids_added"":[""cellml"",""sbgn"",""sbml"",""sbo""]}"
search_route,phase2-physical-modelling,Modelica FMI SysML co-simulation physical modelling ontology standard,,standards_body,structured_non_rdf,standards_body,included_for_phase2_register,included,,"Adds continuous, hybrid, co-simulation, and systems-modelling sources for dynamic-game and digital-twin coverage analysis.",Primarily adjacent modelling-language evidence; term-level mappings require later acquisition and review.,"standards_landscape_researcher,game_theory_gap_researcher",docs/article-hardening/search-log.jsonl,"Physical modelling, co-simulation, and systems engineering standards","{""filters"":{""artifact_type"":""ontology/schema/formalism/standard"",""date_range"":""not_limited"",""language"":""English""},""included_count"":3,""result_count"":3,""screened_count"":3,""source_ids_added"":[""fmi"",""modelica"",""sysml""]}"
search_route,phase2-negative-evidence,game theory ontology OR game theory OWL OR game theory RDF registry repository,,web_search,excluded,web_search,negative_evidence_no_relevant_ontology_found,excluded,,"Targeted searches across registries, repositories, and documentation surfaces found no additional relevant ontology or formalism to include for this route.",The route was intentionally broad and did not surface a releasable ontology artifact for the queried scope.,"evidence_curation_researcher,game_theory_gap_researcher,standards_landscape_researcher",docs/article-hardening/search-log.jsonl,Game-theory ontology registry and repository sweep,"{""filters"":{""artifact_type"":""ontology/schema/formalism/standard"",""date_range"":""not_limited"",""language"":""English""},""included_count"":0,""result_count"":0,""screened_count"":0,""source_ids_added"":[]}"
source_candidate,bfo,Basic Formal Ontology,bfo,upper_ontology,metadata_only,ontology,included,included,baseline-comparator,"BFO is relevant as an upper ontology for interpreting overlap with process, object, role, and temporal semantics.",Imported from completed ontology-comparison baseline; licence and acquisition status remain as recorded there.,"evidence_curation_researcher,reproducibility_curator",docs/article-hardening/source-extension-inventory.json,https://github.com/BFO-ontology/BFO-2020,"{""licence"":{""disposition"":""needs_licence_review"",""name"":""not_recorded"",""redistribution_risk"":""medium"",""url"":null},""mapping_relevance"":""medium"",""parseability"":""metadata_only"",""search_record_ids"":[""phase2-baseline-comparison""],""uogto_module_relevance"":[""core""]}"
source_candidate,bpmn_2,Business Process Model and Notation 2.0,bpmn_2,process_modelling,structured_non_rdf,standard_schema,included,included,process-formalism-comparator,"BPMN event, activity, gateway, and process constructs provide useful comparator evidence for execution/workflow semantics.",Standards licensing may prevent local redistribution.,"standards_landscape_researcher,methods_editor",docs/article-hardening/source-extension-inventory.json,https://www.omg.org/spec/BPMN/2.0.2/,"{""licence"":{""disposition"":""metadata_only"",""name"":""OMG terms"",""url"":null},""mapping_relevance"":""medium"",""parseability"":""structured_non_rdf"",""search_record_ids"":[""phase2-simulation-standards""],""uogto_module_relevance"":[""execution"",""workflow"",""actions"",""events""]}"
source_candidate,cellml,CellML,cellml,systems_biology_modelling,structured_non_rdf,model_exchange_standard,included,included,simulation-standard-comparator,CellML is relevant for mathematical model structure and simulation context comparisons.,Domain-specific standard; avoid treating it as game-theory evidence.,standards_landscape_researcher,docs/article-hardening/source-extension-inventory.json,https://www.cellml.org/,"{""licence"":{""disposition"":""needs_licence_review"",""name"":""needs_review"",""url"":null},""mapping_relevance"":""medium"",""parseability"":""structured_non_rdf"",""search_record_ids"":[""phase2-systems-biology""],""uogto_module_relevance"":[""dynamics"",""simulation-execution"",""models""]}"
source_candidate,devs,DEVS formalism and DEVS metamodel resources,devs,discrete_event_simulation,structured_non_rdf,formalism_or_metamodel,included,included,baseline-comparator,"DEVS concepts such as atomic/coupled models, events, state transitions, and simulation time overlap UOGTO dynamics and execution traces.",Imported from completed ontology-comparison baseline; licence and acquisition status remain as recorded there.,"evidence_curation_researcher,reproducibility_curator",docs/article-hardening/source-extension-inventory.json,https://acims.asu.edu/devs/,"{""licence"":{""disposition"":""metadata_only"",""name"":""not_recorded"",""redistribution_risk"":""medium"",""url"":null},""mapping_relevance"":""high"",""parseability"":""structured_non_rdf"",""search_record_ids"":[""phase2-baseline-comparison""],""uogto_module_relevance"":[""petri-net-devs-hla"",""dynamics""]}"
source_candidate,dolce,DOLCE,dolce,upper_ontology,metadata_only,ontology,included,included,baseline-comparator,"DOLCE provides foundational categories useful when comparing events, qualities, agents, and social objects across modelling ontologies.",Imported from completed ontology-comparison baseline; licence and acquisition status remain as recorded there.,"evidence_curation_researcher,reproducibility_curator",docs/article-hardening/source-extension-inventory.json,https://www.loa.istc.cnr.it/dolce/overview.html,"{""licence"":{""disposition"":""needs_licence_review"",""name"":""not_recorded"",""redistribution_risk"":""medium"",""url"":null},""mapping_relevance"":""medium"",""parseability"":""metadata_only"",""search_record_ids"":[""phase2-baseline-comparison""],""uogto_module_relevance"":[""core""]}"
source_candidate,emmo,European Materials and Modelling Ontology,emmo,upper_modelling_reference,metadata_only,ontology,included,included,baseline-comparator,EMMO is a modelling-oriented upper/reference ontology used by materials modelling and simulation ontology ecosystems.,Imported from completed ontology-comparison baseline; licence and acquisition status remain as recorded there.,"evidence_curation_researcher,reproducibility_curator",docs/article-hardening/source-extension-inventory.json,https://github.com/emmo-repo/EMMO,"{""licence"":{""disposition"":""needs_licence_review"",""name"":""not_recorded"",""redistribution_risk"":""medium"",""url"":null},""mapping_relevance"":""high"",""parseability"":""metadata_only"",""search_record_ids"":[""phase2-baseline-comparison""],""uogto_module_relevance"":[""core"",""article-hardening""]}"
source_candidate,fmi,Functional Mock-up Interface,fmi,physical_modelling,structured_non_rdf,interface_standard,included,included,simulation-interoperability-comparator,"FMI is relevant to simulator coupling, model exchange, and co-simulation bindings.","Interface standard, not a standalone ontology source.","standards_landscape_researcher,reproducibility_curator",docs/article-hardening/source-extension-inventory.json,https://fmi-standard.org/,"{""licence"":{""disposition"":""metadata_only"",""name"":""needs_review"",""url"":null},""mapping_relevance"":""medium"",""parseability"":""structured_non_rdf"",""search_record_ids"":[""phase2-physical-modelling""],""uogto_module_relevance"":[""execution-bindings"",""simulation-execution"",""digital-twin-games""]}"
source_candidate,game_ontology_project,Game Ontology Project,game_ontology_project,game_studies,metadata_only,vocabulary,included,included,baseline-comparator,The Game Ontology Project is a structured game concept vocabulary relevant to UOGTO's game specification and outcome concepts.,Imported from completed ontology-comparison baseline; licence and acquisition status remain as recorded there.,"evidence_curation_researcher,reproducibility_curator",docs/article-hardening/source-extension-inventory.json,https://www.gameontology.com/,"{""licence"":{""disposition"":""metadata_only"",""name"":""not_recorded"",""redistribution_risk"":""medium"",""url"":null},""mapping_relevance"":""medium"",""parseability"":""metadata_only"",""search_record_ids"":[""phase2-baseline-comparison""],""uogto_module_relevance"":[""core"",""article-hardening""]}"
source_candidate,gdl_ii_iii_gdlz,"GDL-II, GDL-III, and GDLZ variants",gdl_ii_iii_gdlz,game_description_language,literature_only,formal_language_family,included,included,game-formalism-comparator,"These GDL variants are relevant for imperfect information, epistemic, and extended game-description constructs that may expose UOGTO gaps.",Likely literature-only until a stable public specification artifact is acquired.,game_theory_gap_researcher,docs/article-hardening/source-extension-inventory.json,https://doi.org/10.1007/978-3-319-71649-7_15,"{""licence"":{""disposition"":""metadata_only"",""name"":""publisher_restricted"",""url"":null},""mapping_relevance"":""high"",""parseability"":""literature_or_documentation"",""search_record_ids"":[""phase2-game-description""],""uogto_module_relevance"":[""imperfect-information"",""epistemic-games"",""dynamic-games""]}"
source_candidate,gdlf_gamelan,Game Description Language and GDL resources,gdlf_gamelan,game_description_language,structured_non_rdf,formal_language,included,included,baseline-comparator,"Game Description Language models game rules, states, legal moves, and terminal conditions that overlap UOGTO rules/actions/outcomes.",Imported from completed ontology-comparison baseline; licence and acquisition status remain as recorded there.,"evidence_curation_researcher,reproducibility_curator",docs/article-hardening/source-extension-inventory.json,https://en.wikipedia.org/wiki/Game_Description_Language,"{""licence"":{""disposition"":""metadata_only"",""name"":""not_recorded"",""redistribution_risk"":""low"",""url"":null},""mapping_relevance"":""medium"",""parseability"":""structured_non_rdf"",""search_record_ids"":[""phase2-baseline-comparison""],""uogto_module_relevance"":[""game-specification"",""rules"",""actions""]}"
source_candidate,gvgai_vgdl,General Video Game AI and VGDL resources,gvgai_vgdl,game_description_language,structured_non_rdf,benchmark_framework_and_language,included,included,game-ai-comparator,"GVGAI/VGDL is relevant to executable game descriptions, state transitions, and agent evaluation settings.",Benchmark artifacts vary by version and repository; record exact release before acquisition.,"game_theory_gap_researcher,standards_landscape_researcher",docs/article-hardening/source-extension-inventory.json,https://www.gvgai.net/,"{""licence"":{""disposition"":""needs_licence_review"",""name"":""needs_review"",""url"":null},""mapping_relevance"":""medium"",""parseability"":""structured_non_rdf"",""search_record_ids"":[""phase2-game-description""],""uogto_module_relevance"":[""actions"",""state"",""game-ai"",""simulation-execution""]}"
source_candidate,hla_fom,High Level Architecture Federation Object Model resources,hla_fom,distributed_simulation,structured_non_rdf,standard_schema,included,included,baseline-comparator,"HLA/FOM resources are relevant to distributed simulation object, interaction, federation, and execution interoperability semantics.",Imported from completed ontology-comparison baseline; licence and acquisition status remain as recorded there.,"evidence_curation_researcher,reproducibility_curator",docs/article-hardening/source-extension-inventory.json,https://www.sisostds.org/,"{""licence"":{""disposition"":""metadata_only"",""name"":""not_recorded"",""redistribution_risk"":""high"",""url"":null},""mapping_relevance"":""medium"",""parseability"":""structured_non_rdf"",""search_record_ids"":[""phase2-baseline-comparison""],""uogto_module_relevance"":[""petri-net-devs-hla"",""execution-bindings""]}"
source_candidate,kaos,KAoS ontology and policy services,kaos,agent_policy,metadata_only,ontology_framework,included,included,baseline-comparator,"KAoS is relevant to multi-agent permissions, obligations, policy, and agent coordination semantics adjacent to UOGTO deontic and agent modules.",Imported from completed ontology-comparison baseline; licence and acquisition status remain as recorded there.,"evidence_curation_researcher,reproducibility_curator",docs/article-hardening/source-extension-inventory.json,https://ontology.ihmc.us/kaos.html,"{""licence"":{""disposition"":""needs_licence_review"",""name"":""not_recorded"",""redistribution_risk"":""medium"",""url"":null},""mapping_relevance"":""medium"",""parseability"":""metadata_only"",""search_record_ids"":[""phase2-baseline-comparison""],""uogto_module_relevance"":[""core"",""article-hardening""]}"
source_candidate,kisao,Kinetic Simulation Algorithm Ontology,kisao,simulation_algorithm,metadata_only,ontology,included,included,baseline-comparator,KiSAO is directly relevant to simulation algorithm semantics and SED-ML algorithm references.,Imported from completed ontology-comparison baseline; licence and acquisition status remain as recorded there.,"evidence_curation_researcher,reproducibility_curator",docs/article-hardening/source-extension-inventory.json,https://github.com/SED-ML/KiSAO,"{""licence"":{""disposition"":""needs_licence_review"",""name"":""not_recorded"",""redistribution_risk"":""medium"",""url"":null},""mapping_relevance"":""high"",""parseability"":""metadata_only"",""search_record_ids"":[""phase2-baseline-comparison""],""uogto_module_relevance"":[""simulation-execution""]}"
source_candidate,ludii,Ludii general game system,ludii,game_description_language,structured_non_rdf,software_language_repository,included,included,game-formalism-comparator,Ludii game descriptions provide structured cross-game constructs useful for evaluating UOGTO rule and component coverage.,Licence and corpus redistribution need review before source acquisition.,"game_theory_gap_researcher,reproducibility_curator",docs/article-hardening/source-extension-inventory.json,https://ludii.games/,"{""licence"":{""disposition"":""needs_licence_review"",""name"":""needs_review"",""url"":null},""mapping_relevance"":""high"",""parseability"":""structured_non_rdf"",""search_record_ids"":[""phase2-game-description""],""uogto_module_relevance"":[""game-specification"",""rules"",""actions"",""outcomes"",""players""]}"
source_candidate,miase,Minimum Information About a Simulation Experiment,miase,simulation_experiment,metadata_only,minimum_information_standard,included,included,baseline-comparator,MIASE provides reporting requirements for simulation experiments that can be compared with UOGTO model/session/trace coverage.,Imported from completed ontology-comparison baseline; licence and acquisition status remain as recorded there.,"evidence_curation_researcher,reproducibility_curator",docs/article-hardening/source-extension-inventory.json,https://co.mbine.org/standards/miase,"{""licence"":{""disposition"":""metadata_only"",""name"":""not_recorded"",""redistribution_risk"":""low"",""url"":null},""mapping_relevance"":""medium"",""parseability"":""metadata_only"",""search_record_ids"":[""phase2-baseline-comparison""],""uogto_module_relevance"":[""simulation-execution"",""execution-traces""]}"
source_candidate,modelica,Modelica language and Modelica Standard Library,modelica,physical_modelling,structured_non_rdf,modelling_language,included,included,simulation-language-comparator,Modelica is relevant to equation-based continuous and hybrid simulation semantics that overlap UOGTO dynamic-game extensions.,Language/library evidence should be charted separately from ontology evidence.,"standards_landscape_researcher,game_theory_gap_researcher",docs/article-hardening/source-extension-inventory.json,https://modelica.org/,"{""licence"":{""disposition"":""metadata_only"",""name"":""needs_review"",""url"":null},""mapping_relevance"":""medium"",""parseability"":""structured_non_rdf"",""search_record_ids"":[""phase2-physical-modelling""],""uogto_module_relevance"":[""continuous-games"",""differential-hybrid-games"",""simulation-execution""]}"
source_candidate,oaei,Ontology Alignment Evaluation Initiative,oaei,mapping_evaluation_benchmark,metadata_only,benchmark_programme,included,included,mapping-method-context,OAEI is relevant background for reporting ontology mapping evaluation and manual review calibration.,Benchmark tracks are heterogeneous and not a single ontology source.,"standards_landscape_researcher,methods_editor",docs/article-hardening/source-extension-inventory.json,https://oaei.ontologymatching.org/,"{""licence"":{""disposition"":""needs_licence_review"",""name"":""varies_by_track"",""url"":null},""mapping_relevance"":""medium"",""parseability"":""metadata_only"",""search_record_ids"":[""phase2-mapping-standards""],""uogto_module_relevance"":[""ontology-comparison"",""mapping-robustness""]}"
source_candidate,odd_protocol,ODD protocol for agent-based models,odd_protocol,agent_based_modelling,metadata_only,reporting_protocol,included,included,baseline-comparator,"ODD captures overview/design concepts/details of agent-based models and can be mapped to UOGTO specifications, agents, state, and processes.",Imported from completed ontology-comparison baseline; licence and acquisition status remain as recorded there.,"evidence_curation_researcher,reproducibility_curator",docs/article-hardening/source-extension-inventory.json,https://www.jasss.org/23/2/7.html,"{""licence"":{""disposition"":""metadata_only"",""name"":""not_recorded"",""redistribution_risk"":""medium"",""url"":null},""mapping_relevance"":""medium"",""parseability"":""metadata_only"",""search_record_ids"":[""phase2-baseline-comparison""],""uogto_module_relevance"":[""agents"",""simulation-execution""]}"
source_candidate,ontouml_ufo,OntoUML / Unified Foundational Ontology,ontouml_ufo,upper_ontology,structured_non_rdf,ontology_or_metamodel,included,included,baseline-comparator,"OntoUML/UFO can inform conceptual modelling comparisons for agents, events, relations, roles, and social commitments.",Imported from completed ontology-comparison baseline; licence and acquisition status remain as recorded there.,"evidence_curation_researcher,reproducibility_curator",docs/article-hardening/source-extension-inventory.json,https://ontouml.org/,"{""licence"":{""disposition"":""needs_licence_review"",""name"":""not_recorded"",""redistribution_risk"":""medium"",""url"":null},""mapping_relevance"":""medium"",""parseability"":""structured_non_rdf"",""search_record_ids"":[""phase2-baseline-comparison""],""uogto_module_relevance"":[""core""]}"
source_candidate,osmo,"Ontology for Simulation, Modelling, and Optimization",osmo,modelling_simulation_interoperability,metadata_only,ontology,included,included,baseline-comparator,"OSMO is explicitly about simulation, modelling, and optimization and is likely to overlap UOGTO model/execution/binding semantics.",Imported from completed ontology-comparison baseline; licence and acquisition status remain as recorded there.,"evidence_curation_researcher,reproducibility_curator",docs/article-hardening/source-extension-inventory.json,https://github.com/virtual-materials-marketplace/osmo,"{""licence"":{""disposition"":""needs_licence_review"",""name"":""not_recorded"",""redistribution_risk"":""medium"",""url"":null},""mapping_relevance"":""high"",""parseability"":""metadata_only"",""search_record_ids"":[""phase2-baseline-comparison""],""uogto_module_relevance"":[""models"",""execution-bindings""]}"
source_candidate,owl_s,OWL-S Semantic Markup for Web Services,owl_s,process_service_ontology,metadata_only,ontology_submission,included,included,process-ontology-comparator,OWL-S process/service concepts are relevant to UOGTO executable action and binding semantics.,"Recorded as metadata-only until a specific OWL file, checksum, and licence are captured.","registry_discovery_researcher,reproducibility_curator",docs/article-hardening/source-extension-inventory.json,https://www.w3.org/Submission/OWL-S/,"{""licence"":{""disposition"":""needs_licence_review"",""name"":""W3C document terms"",""url"":null},""mapping_relevance"":""medium"",""parseability"":""parsed_rdf_owl_candidate"",""search_record_ids"":[""phase2-simulation-standards""],""uogto_module_relevance"":[""actions"",""processes"",""execution-bindings""]}"
source_candidate,owl_time,OWL-Time,owl_time,time,parsed_rdf_owl,ontology,included,included,baseline-comparator,"OWL-Time supports temporal intervals and instants relevant to sessions, traces, event timing, and simulation time.",Imported from completed ontology-comparison baseline; licence and acquisition status remain as recorded there.,"evidence_curation_researcher,reproducibility_curator",docs/article-hardening/source-extension-inventory.json,https://www.w3.org/TR/owl-time/,"{""licence"":{""disposition"":""redistributable_artifact"",""name"":""not_recorded"",""redistribution_risk"":""low"",""url"":null},""mapping_relevance"":""medium"",""parseability"":""parsed_rdf_owl_candidate"",""search_record_ids"":[""phase2-baseline-comparison""],""uogto_module_relevance"":[""dynamics"",""execution-traces""]}"
